{
  "category": "music",
  "topic": "Rock Pop",
  "count": 7,
  "facts": [
    "Rock-pop blends the strong guitars and drums of rock with the catchy melodies and hooks of pop music.",
    "The electric guitar became a key rock-pop sound after it was popularized in the 1950s with amplifiers and effects.",
    "A song’s “hook” is the short, memorable part that repeats and helps listeners recognize the track quickly.",
    "Many rock-pop bands use a standard setup of vocals, guitar, bass, and drums, but keyboards are also common.",
    "Studio techniques like multitrack recording let artists record different instruments separately and layer them into one song.",
    "Music videos helped rock-pop artists reach huge audiences, especially after MTV launched in 1981.",
    "Live concerts often use sound checks so the band and crew can balance volumes and reduce feedback before the show starts."
  ],
  "sources_hint": "general knowledge; verify if needed",
  "generated_at": "2026-02-09T17:39:57.728Z"
}
