{
  "category": "everyday_life",
  "topic": "Health",
  "count": 7,
  "facts": [
    "Washing your hands with soap for about 20 seconds helps remove germs that can make you sick.",
    "Your skin is the bodyâ€™s largest organ and it protects you from germs, sun, and losing too much water.",
    "Sleeping enough helps your brain store memories and helps your body repair itself.",
    "Drinking water helps your blood carry nutrients and helps your body control its temperature through sweat.",
    "Regular exercise strengthens your heart and lungs, making it easier to do everyday activities without getting tired.",
    "Vaccines train your immune system to recognize certain germs so it can fight them faster later.",
    "Eating a variety of colorful fruits and vegetables can provide vitamins, minerals, and fiber that support overall health."
  ],
  "sources_hint": "general knowledge; verify if needed",
  "generated_at": "2026-02-09T17:52:59.342Z"
}
